answer,preprocessing_result,sentimen
kalo bisa sertifikasi dihapus saja dari mata kuliah,kalo sertifikasi hapus dari mata kuliah,0
Good dosen,good dosen,0
dosen yg baik,dosen yg baik,1
kuliahnya cukup tegang dan senam jantung bu,kuliah cukup tegang senam jantung bu,1
good,good,0
baik,baik,1
lanjutkan,lanjut,0
Tingkatkan dan Pertahankan,tingkat tahan,0
"Ibu, tolong pada pengoreksian hasil UTS/UAS lebih teliti karena terdapat 2 jawaban sama tapi nilainya berbeda, kesibukan ibu sangat dimaklumi",ibu pada koreksi hasil uts uas lebih teliti dapat 2 jawab sama nilai beda sibuk ibu sangat maklum,1
Soalnya diperbanyak dan menjelaskan penyelesaiannya harus rinci biar cepat dan mudah dipahami,soal banyak jelas selesai rinci biar cepat mudah paham,0
Cinta ibu jamil tersayang,cinta ibu jamil sayang,1
Terbaik,baik,1
Lebih bisa masuk tepat waktu,lebih masuk tepat waktu,1
Beliau mengajar seperti guru TK..,beliau ajar guru tk,0
Terimakasih utk pengenalan muhammadiyah kpd kami.,terimakasih utk kenal muhammadiyah kpd,1
Klalu ngajar mhs jangan samakan deng anak SMP.,klalu ngajar mhs jangan sama deng anak smp,1
Saat mengajar jangan terlalu cepat menerangkan materi supaya mahasiswa tidak ketinggalan materinya,ajar jangan terlalu cepat terang materi mahasiswa tinggal materi,0
 Ketika ada kuliah pengganti harus mengkonfirmasi dulu,ada kuliah ganti konfirmasi dulu,0
Banyakin tugas proyek dan presentasi untuk melatih hardskill dan softskill manusia.,banyakin tugas proyek presentasi latih hardskill softskill manusia,0
Harus bisa membuat suasana menyenangkan agar mhs tidak bosan.,bisa buat suasana senang mhs bosan,0
Motivasi untuk mhs sangat penying.,motivasi mhs sangat sing,0
Terlalu tugas..,terlalu tugas,0
Lanjutkan.,lanjut,0
tingkatkan ya,tingkat,0
lanjut terus pak..,lanjut terus pak,1
good job...,good job,0
mantap... kasih nilai bagus ya pak.,mantap kasih nilai bagus pak,1
jangan pelit nilai itu saja.,jangan pelit nilai saja,0
Baik,baik,1
Lanjutkan,lanjut,0
Semangat,semangat,1
Sipp,sipp,0
Kurang jalan? Toleransi nilai,kurang jalan toleransi nilai,0
Makin diperjelas materinya,makin jelas materi,0
Besok UAS pasti susah,besok uas susah,0
Ilove you bu,ilove you bu,0
"Jangan terlalu sering kosong, penguasaan materi harus lebih ditingkatkan lagi",jangan terlalu sering kosong kuasa materi lebih tingkat,0
"Laporan KP baru bab 3 , masih revisi",lapor kp baru bab 3 revisi,0
Way of life,way of life,0
Semoga bisa masuk,moga masuk,1
Kurang Mengetahui Karena Masuk I kali sisanya Pak Iksan,kurang tahu masuk i kali sisa pak iksan,0
Lebih sering mengajar Rangkaian Listrik Agar tidak sulit mengajar / menguasai kelas,lebih sering ajar rangkai listrik tidak sulit ajar kuasa kelas,0
Semangat dan maju terus pak..,semangat maju terus pak,1
Tingkatkan sarana dan pra sarana..,tingkat sarana pra sarana,0
"Kuliah selalu kosong, samapai-sampai ujian pun di blok. dikarenakan memasukan absensi ke TU telat",kuliah selalu kosong samapai-sampai uji di blok pasu absensi tu telat,1
"Harap lebih sering memberikan kuliah, karena mata kuliah ini cukup sulit untuk dipahami sehingga amat sangat penting adanya perkuliahan",harap lebih sering beri kuliah mata kuliah cukup sulit paham amat sangat penting kuliah,1
"Sebaiknya dosen juga memikirkan apabila orang tua mahasiswa mencari uang dengan susah payah, jadi dosen juga harus memikirken hak mahasiswa. Dosen yang tidak mengajar adalah berarti tidak dapat memikul amanah",baik dosen pikir apabila orang tua mahasiswa cari uang susah payah jadi dosen harus memikirken hak mahasiswa dosen ajar arti tidak dapat pikul amanah,0
"Semoga adik tingkat, tidak mengalami situasi sepert ini lagi",moga adik tingkat alami situasi sepert lagi,0
SIPP 100 % lanjutkan,sipp 100 lanjut,0
Lebih Tepat Waktu Saat Jam Perkuliahan dimulai,lebih tepat waktu jam kuliah mulai,0
Mohon tidak memakai istilah2 kelistrikanyg terdapat dlm materi tsb karena tidak semua mhsw paham karena ada mhsw yg harus memulai lagi dari nol,mohon pakai istilah2 kelistrikanyg dlm materi tsb tidak semua mhsw paham ada mhsw yg mulai dari nol,0
Tingkatkan terus,tingkat terus,0
saya tidak paham . Tolong kejelasan dan materi yang sesuai,tidak paham jelas materi sesuai,0
tingkatkan,tingkat,0
Lebih Sering hadir pada perkuliahan,lebih sering hadir kuliah,1
Dosennya kurang materi untuk diberikan,dosen kurang materi beri,0
Dosennya jarang  menghadiri kelas padahal Pak sunardi bagus ngajarnya. semoga besok bisa lebih baik,dosen jarang hadir kelas padahal pak sunardi bagus ngajarnya moga besok lebih baik,1
Tolong dosen lebih Konsisten,dosen lebih konsisten,1
ok Bu,bu,0
Lebih mengutamakan mahasiswa untuk melalukakn UAS,lebih utama mahasiswa melalukakn uas,0
lebih mempertegas dan mengkondisikan kelas,lebih tegas kondisi kelas,0
sangat perfect,sangat perfect,1
goodjob,goodjob,0
excelent Bu,excelent bu,0
tidak ada manusia yg sempurna,ada manusia yg sempurna,1
jangan terlalu galak dong,jangan terlalu galak dong,0
jangan serius bu,jangan serius bu,1
Materi yg diberikan pd saat kuliah lbh rinci lbh sering memberikan contoh soal hitungan.,materi yg beri pd kuliah lbh rinci lbh sering beri contoh soal hitung,1
Tingkatkan performance.,tingkat performance,0
Sementara ini cara menyampaikan materi cukup baik.,ini cara materi cukup baik,0
Kalau ada keperluan sebaiknya kabari ke perwakilan.,kalau perlu baik kabar wakil,0
"Lebih adil mengayomi, membimbing seluruh mhs.",lebih adil ayom bimbing seluruh mhs,0
Tepat Waktu,tepat waktu,1
Lanjutkan Bu,lanjut bu,0
Kalau menjelaskan didepan mohon jgn terlalu cepat agar bisa dimengerti,kalau jelas depan mohon jgn terlalu cepat bisa erti,0
lebih pelan mengajarnya,lebih pelan ajar,0
saya si yes,si yes,0
Lebih ditingkatkan,lebih tingkat,0
sudah baik,baik,1
pada saat menjelaskan tolong diperjelas cara berbicaranya,saat jelas jelas cara bicara,0
tolong diperjelas suaranya,jelas suara,1
cara dosen mengajarnya kurang jelas dan kurang menarik,cara dosen ajar kurang jelas kurang tarik,0
keterampilan dosen sangat kurang dalam mengajar meskipun sudah menguasai materi,terampil dosen sangat kurang ajar meski kuasa materi,1
ilmu dalam mengajar dosen sangat kurang,ilmu ajar dosen sangat kurang,0
dalam memberi materi tolong lebih pelan dan jgn tergesa gesa sekian,beri materi lebih pelan jgn gesa gesa sekian,1
no coman,no coman,1
butuh dosen yg mengerti kemampuan setiap mhsw,butuh dosen yg erti mampu tiap mhsw,1
dalam menerangakan ucapanya kurang jelas dan menjelaskan terlalu cepat sehing mhsw sulit utk memahami,rangak ucapanya kurang jelas jelas terlalu cepat sehing mhsw sulit utk paham,0
 saat mengajar seharusnya lebih pelan dan banyak membrei contoh agar lebih mudah dimengerti,ajar lebih pelan banyak membrei contoh lebih mudah erti,0
jika ada dosen menanyakan pertanyaan apa tidak dan mhsw diam itu biasanya mhsw belum paham,ada dosen tanya tanya apa dan mhsw diam biasa mhsw paham,0
cara menjelaskan tolong diperbaiki dan ajak mhsw utk giat belajar kalkulus,cara jelas baik ajak mhsw utk giat ajar kalkulus,0
Cara mengajarnya bagus secara mandiri,cara ajar bagus cara mandiri,0
terbaiklah sukseslah pak barakailah fi umrik wich you all the best,baik sukses pak barakailah fi umrik wich you all the best,1
tugas jangan terlalu banyak,tugas jangan terlalu banyak,0
pak jngn banyak2 tugas,pak jngn banyak2 tugas,1
waktu mengerjakan tugas rumah agar diperpanjang,waktu kerja tugas rumah panjang,0
bpk waktu memberi tugas waktu mengumpulkan jgn terlalu cepat,bpk waktu beri tugas waktu kumpul jgn terlalu cepat,0
agar tidak memberi tugas yg banyak,tidak beri tugas yg banyak,1
saya bingung pak mau comen apa bpk terlalu sempurna tapi jng terlalu banyak tugas ya,bingung pak mau comen apa bpk terlalu sempurna jng terlalu banyak tugas,0
semoga kedepanya lebih baik,moga depa lebih baik,1
selalu menginspirasi terus ya pak,selalu inspirasi terus pak,1
tetap jadi pengajar yg menyenangkan ya pak,tetap jadi ajar yg senang pak,1
mengajarnya perlahan lahan pak kami tidak sepintar bpk,ajar perlahan lahan pak tidak pintar bpk,1
no comen asik gokil dosenya pak zarul,no comen asik gokil dosenya pak zarul,1
sebaiknya mata kuliah menggambar teknik diadakan dipagi hari krn kalau siang membuat ngantuk,baik mata kuliah gambar teknik pagi hari krn kalau siang buat ngantuk,1
Jangan Kuliah Malam,jangan kuliah malam,1
Tingkatkan lagi cara mengajarnya,tingkat cara ajar,0
saya suka,suka,0
Harus sering memotivasi mhs. supaya minat belajar lebih tinggi,sering motivasi mhs minat ajar lebih tinggi,0
Lebih santai lagi dalam menyampaikan kepada mahasiswanya,lebih santai dalam kepada mahasiswa,0
Pertahankan,tahan,0
Tingkatkan dalam mengajarnya jangan pelit memberi nilai,tingkat ajar jangan pelit beri nilai,0
Buat Elektro kelasnya cukup banyak mahasiswanya jadi gak pada kon sen setidaknya dibagai 2 kelas,buat elektro kelas cukup banyak mahasiswa jadi gak kon sen bagai 2 kelas,1
Sangat memotivasi mahasiswanya,sangat motivasi mahasiswa,0
sukses terus bapak,sukses terus bapak,1
lanjutkan Pak,lanjut pak,1
Tolong suaranya diperjelas dan menjelaskan materinya dengan perlahan..,suara jelas jelas materi perlahan,1
Ngajarnya harus lebih jelas dong..,ngajarnya lebih jelas dong,0
Ngomongnya gak begitu jelas...,ngomongnya gak jelas,0
"Saya sangat suka cara menyampaikannya mudah, terima kasih bpk!!",sangat suka cara mudah terima kasih bpk,1
Harus ada ketegasan dosen thd mhs yg nyleneh.,ada tegas dosen thd mhs yg nyleneh,0
Kalau memberikan materi santai saja jangan terlalu cepat agar mhs mengerti.,kalau beri materi santai jangan terlalu cepat mhs erti,0
tolong Lebih di kontrol lagi emosi dan Perkataannya,lebih kontrol emosi kata,0
Diharapkan memberi materi kuliah untuk pertemuan selanjutnya seperti dlm bentuk FC atau lainnya.,harap beri materi kuliah temu lanjut dlm bentuk fc lain,1
Untuk setiap tugas diharapkan untuk dikoreksi.,tiap tugas harap koreksi,0
Suara bpk kurang kedengaran..,suara bpk kurang dengar,1
Mohon penjelasannya lebih detail.,mohon jelas lebih detail,1
alam penjelasan lebih dirinci dengan pemahaman yg lebih sederhana.,alam jelas lebih dirinci paham yg lebih sederhana,0
Jangan terlalu cepat dlm mengajar.,jangan terlalu cepat dlm ajar,0
Ketika menjelaskan kurang bisa dipahami.,jelas kurang paham,0
Terima kasih ibu....,terima kasih ibu,1
Jangan itu2 saja mhs yg ditanya/ diperhatikan.,jangan itu2 mhs yg tanya perhati,0
Ibu jgn terlalu cepat menerangkan.,ibu jgn terlalu cepat terang,0
Lebih baik ibu tdk terlalu memberi tugas.,lebih baik ibu tdk terlalu beri tugas,1
Semoga kedepan lebih baik.,moga depan lebih baik,1
Jgn terlalu cepat menyampaikan materi.,jgn terlalu cepat materi,0
Tolon contoh soal yg dijelaskan lebih detail agar tdk bingung.,tolon contoh soal yg jelas lebih detail tdk bingung,0
Ibu yg Baik jelasin materi pelan pelan Yah,ibu yg baik jelasin materi pelan pelan yah,1
Teruskan,terus,1
Saya suka dgn cara beliu Mengajar,suka dgn cara beliu ajar,0
kalau jelasi jgn terlalu cepat yg penting semua bisa paham,kalau jelas jgn terlalu cepat yg penting semua paham,0
jgn telat masuk dan telat waktunya,jgn telat masuk telat waktu,1
jgn terlalu cepat mengajar materi Mending lebih pelan santai dan paham,jgn terlalu cepat ajar materi mending lebih pelan santai paham,0
buk menjelaskanya pelan pelan ya,buk menjelaskanya pelan pelan,0
pelan pelan mengajarkanya kepala saya pusing,pelan pelan mengajarkanya kepala pusing,0
Pelan2 saja menerngkanya,pelan2 menerngkanya,0
bagus sekali menerangkanya,bagus sekali angka,1
tetap kalem bu,tetap kalem bu,1
ngajarnya lebih diperbaiki bu soalnya banyak yg tdk mengerti,ngajarnya lebih baik bu soal banyak yg tdk erti,1
jgn dikit2 nilainya ya bu lain kali klau ngasih soal jgn susah2,jgn dikit2 nilai bu kali klau ngasih soal jgn susah2,0
saya harap dlm perkuliahan pilihanpenyampaian materi harus lebih mendalamagar mhsw paham,harap dlm kuliah pilihanpenyampaian materi lebih mendalamagar mhsw paham,0
Sebaiknya mhsw diperhatikan contoh dari hasil pengukuran kinerja atau lembar pengukuran kerjanya,baik mhsw perhati contoh hasil ukur kerja lembar ukur kerja,1
bu lamjutkan dan semoga tetap sabar ingatkan kami jika kami salah baik ucapan maupon tindakan,bu lamjutkan moga tetap sabar ingat jika salah baik ucap maupon tindak,1
siraman rohani pagi paginya di tingkatkan bu membuat saya semangat,siram rohani pagi pagi tingkat bu buat semangat,1
tugasnya jgn terlalu banyak nilai oky,tugas jgn terlalu banyak nilai oky,0
mantap,mantap,1
semangat ya pak,semangat pak,1
no comen,no comen,1
saran say adalah tolong gunakanreferensi buku yg jelas tidak hanya mengandalkan slide saja,saran say tolong gunakanreferensi buku yg jelas hanya andal slide,0
lebih ditingkatkan lagi pak,lebih tingkat pak,1
ok,,0
jgn pelit nilai ya pak,jgn pelit nilai pak,1
ok,,0
nilai maksimal A pak,nilai maksimal a pak,1
terlalu sering menganmcam unt mendapatkan perkuliahan yg diinginkan,terlalu sering menganmcam unt kuliah yg,0
kata2nya sering membingungkan,kata2nya sering bingung,0
jadilah triggar pak semoga yg anda sampaikan menjadikan kami berkarakater,jadi triggar pak moga yg sampai jadi berkarakater,1
lebih baik dari semester lalu dalam hal penguasaan kelas namun cara menyampaikan masih susah dipahami,lebih baik semester lalu hal kuasa kelas cara masih susah paham,0
membrikan tugas jgn terlalu mendadak pak,membrikan tugas jgn terlalu dadak pak,1
good,good,0
cara mengajarnya tdk jelas makin membuat mhsw bingung,cara ajar tdk jelas makin buat mhsw bingung,0
semoga sifat dosenya untuk kedepan lebih baik ramah terhadap mhsw,moga sifat dosenya depan lebih baik ramah hadap mhsw,1
pelajaranya diharap sesuai sapdan juga diberi peljcodingya,pelajaranya harap sesuai sapdan beri peljcodingya,1
terlalu diktator menekan mhsw,terlalu diktator tekan mhsw,0
cara mengajar menyerang psikis mhsw,cara ajar serang psikis mhsw,0
sulit dipahami,sulit paham,0
Sebaiknya dosen memberikan contoh tugas yg jelas..,baik dosen beri contoh tugas yg jelas,1
sebaiknya dosen lebih sering membuat forum diskusi..,baik dosen lebih sering buat forum diskusi,1
"untuk masukan agar lebih memberikan ide penelitian apa yg cocok, untuk pengolahannya bingung.",masuk lebih beri ide teliti apa yg cocok olah bingung,1
Lebih baik jika ada modul utk kuliah pengantar penelitian..,lebih baik ada modul utk kuliah antar teliti,1
Bpk jgn suka marah2 dan kalau memberi tugas tolong jgn sampai menumpuk..,bpk jgn suka marah2 kalau beri tugas jgn tumpuk,0
Materinya diperjelas jgn banyak memberi tugas.,materi jelas jgn banyak beri tugas,1
Tolong jangan PHP in mhsnya.,jangan php in mhsnya,0
Tugasnya terlalu banyak..,tugas terlalu banyak,0
Contoh berikan contoh soal yg lebih banyak dan bervariasi,contoh ikan contoh soal yg lebih banyak variasi,0
suaranya kurang jejas,suara kurang jejas,0
Jangan sering meninggalkan kelas,jangan sering tinggal kelas,0
semangat lagi bu,semangat bu,1
Perbanyak penjelasan.,banyak jelas,0
Terima kasih bpk telah mangajukan kami tentang arti kehidupan..,terima kasih bpk mangajukan tentang arti hidup,1
semangat bu,semangat bu,1
very good,very good,0
tetap semangat mengajar bu,tetap semangat ajar bu,1
profesional,profesional,1
pertahankan bu trus menjadi lebih baik lagi,tahan bu trus jadi lebih baik,1
"UAS open book, soalnya jgn susah2",uas open book soal jgn susah2,0
Hrs lebih memperhatikan mhs yg kurang mengerti .,hrs lebih perhati mhs yg kurang erti,0
Pertahankan cara mengajarnya agar anak2 senang dalam kuliah.,tahan cara ajar anak2 senang kuliah,0
rs lebih tegas dg mhs yg ribut.,rs lebih tegas dg mhs yg ribut,0
Suaranya tolong diperjelas ya pak...,suara jelas pak,1
Yg belakang kurang jelas jadi ribut sendiri.,yg belakang kurang jelas jadi ribut sendiri,0
Mhsnya aja bodoh kalau  gak ngerti saat dosen jelasin.,mhsnya aja bodoh kalau gak ngerti dosen jelasin,0
Tingkatkan kualitas dosen.,tingkat kualitas dosen,0
Teruskan perjuangan.....,terus juang,1
Semangat terus buuuu.....,semangat terus buuuu,1
lebih memberikan pelajaran yg menyenangakn agar tida k bosan didlm ruangan,lebih beri ajar yg menyenangakn tida k bosan didlm ruang,0
Sangat baik.....,sangat baik,1
Lebih memberikan semangat kpd mahasiswanya.,lebih beri semangat kpd mahasiswa,1
Tidak membosankan..,bosan,0
Sebaiknya saat mengajar ditampilkan slide agar lebih mudah memahami.,baik ajar tampil slide lebih mudah paham,0
Tetap semangat pak !!!,tetap semangat pak,1
Mengajar lebih santai dan penjelasannya lebih rinci !!!,ajar lebih santai jelas lebih rinci,0
Sungguh mengesankan,sungguh kesan,0
Tugasnya kurang !!,tugas kurang,0
"Penyampaiannya sulit dicerna, membuat suasana menjadi membosankan.",sulit cerna buat suasana jadi bosan,0
Kedepannya lebih baik lagi !!,depan lebih baik,1
agar menguasai kelas lebih baik,kuasa kelas lebih baik,1
Jangan memberikan tugas yang melebihi batas,jangan beri tugas lebih batas,1
semoga lebih baik,moga lebih baik,1
cukup bagus,cukup bagus,1
lebih baik cara pembelajarannya dikelas dosen jgn presentasi krnlogika ituperlu penjelasan dosen,lebih baik cara ajar kelas dosen jgn presentasi krnlogika ituperlu jelas dosen,0
tugas kalau bisa secepatnya langsung dibagi biar bisa buat belajar,tugas kalau cepat langsung biar buat ajar,0
tugasnya di kurangi !!,tugas kurang,0
tetap semangat buk,tetap semangat buk,1
tugasnya dikurangi !!,tugas rang,0
tugasnya dikurangi,tugas rang,0
tugasnya dikurangi,tugas rang,0
jangan sering kosong,jangan sering kosong,0
tugas jangan terlalu sulit,tugas jangan terlalu sulit,0
semoga lebih baik,moga lebih baik,1
diperbanyak contohnya,banyak contoh,0
tolong tegas kepada mahasiswa,tegas mahasiswa,0
tolong tegas kepada mahasiswa,tegas mahasiswa,0
jangan pelit nilai,jangan pelit nilai,1
"lebih menguasai kelas, ",lebih kuasa kelas,1
Harap dalam mengajar memperhatikan etiika dan sopan santun dalam berbicara. jangan terlalu banyak menggunakan kalimat tidak pantas,harap ajar perhati etiika sopan santun bicara jangan terlalu banyak kalimat pantas,0
"terlalu banyak slide dengan pembahasan yang sangat padat, tidak menggunakan mic sehingga suara tidak terdengar",terlalu banyak slide bahas sangat padat guna mic suara dengar,1
Berikan contoh lain sekaub yang ada du skude,ikan contoh sekaub ada du skude,0
good job,good job,0
Good job pak,good job pak,1
Bapak Keren,bapak keren,1
Jadi dosen pembimbing yang baik Pak,jadi dosen bimbing baik pak,1
Cukup baik tau apa maunya mahazsiswa,cukup baik tau apa mau mahazsiswa,1
"saya harap bapak Dosen merubah cara mengajarnya. Pelajaran Kimia bukan hanya materi baca, kalau bisa ajarkan cara kalkulasi Rumus-rumus yang ada jangan hanya baca yang ada dislide",harap bapak dosen rubah cara ajar ajar kimia bukan materi baca kalau ajar cara kalkulasi rumus ada jangan baca ada dislide,0
"Pak besok kalaugak ada kuliah  pemberian infonya lebih cepat ya Pak, sama kalau ngasihin soal tolong jelaskan yang lebih detail karena banyak yang kurang mengerti",pak besok kalaugak kuliah beri info lebih cepat pak sama kalau ngasihin soal jelas lebih detail banyak kurang erti,1
Bagus,bagus,1
Saat pelajaran on time tepat waktu,ajar on time tepat waktu,0
Sebaiknya dosen menjelaskan materi kuliah harus melibatkan mhs. secara langsung (mahasiswa aktif) dosen jangan menjelaskan materi kuliah hanya terpaku dalam PPT,baik dosen jelas materi kuliah libat mhs cara langsung mahasiswa aktif dosen jangan jelas materi kuliah terpa ppt,0
Perfect,perfect,0
Saya berharap ibu mempertahan cara mengajar seperti ini,harap ibu tahan cara ajar ini,0
Terimakasih Pak,terimakasih pak,1
Dalam memberikan soal atau penjelasana mahasiswanya jangan disamaratakan,beri soal penjelasana mahasiswa jangan disamaratakan,1
Jangan terlalu serius kalau sedang menuampaikan materi,jangan terlalu serius kalau sedang menuampaikan materi,0
Pada saat menerangkan pelajaran lebih pelan,saat terang ajar lebih pelan,1
Pertahankan dan tingkatkan agar menjadi lebih baik,tahan tingkat jadi lebih baik,1
semoga lebih baik ke depannya,moga lebih baik depan,1
Pemberian materi terlalu cepat,beri materi terlalu cepat,0
semoga kedepannya semakin baik,moga depan makin baik,1
ditingkatkan dan dipertahankan sistem mengajarnya,tingkat tahan sistem ajar,0
Ibu dosen sangat baik dalam menyampaikan materi kuliah,ibu dosen sangat baik sampai materi kuliah,1
Ibu dosen sangat baik dalam menyampaikan mata Kuliah,ibu dosen sangat baik sampai mata kuliah,1
Tetap bikin kita semangat belajar,tetap bikin semangat ajar,0
Bu jika mhs. ada yang bertanya tolong di jelaskan secara rinci sampai mhs.nya mengerti ya bu. Terima Kasih,bu mhs yang tanya di jelas cara rinci mhs nya erti bu terima kasih,1
jangan sering terlambat,jangan sering lambat,0
jangan sering terlambat,jangan sering lambat,0
Pertahankan cara mengajarnya Bu,tahan cara ajar bu,0
jangan pelit nilai,jangan pelit nilai,1
Tingkatkan lagi bu mantap,tingkat bu mantap,1
Asik belajar sama Dosennya sistem pengajarnannya mudah dipahami,asik ajar sama dosen sistem pengajarnannya mudah paham,0
Tetap seperti ini bu,tetap ini bu,1
Tingkatkan Kinerjanya Pak,tingkat kerja pak,1
Tolong tepat waktu Pak dan jika ada kesibukan segera konfirmasi,tepat waktu pak jika sibuk segera konfirmasi,1
Tolong Tepat Waktu,tepat waktu,1
Tolong Masuk tepat waktu kalau tidak masuk harap dikonfirmasikan,masuk tepat waktu kalau masuk harap konfirmasi,0
Sangat menyenangkan cuma kurang lama telatnya,sangat senang cuma kurang lama telat,1
Mohon masuk tepat waktu Pak,mohon masuk tepat waktu pak,1
Kalau menjelaskan lebih jelas. Mohon masuk tepat waktu,kalau jelas lebih jelas mohon masuk tepat waktu,0
 Disiplin waktu masuk kuliah,disiplin waktu masuk kuliah,0
Tingkatkan dan lanjutkan,tingkat lanjut,0
Sukses terus pak,sukses terus pak,1
Materinya disesuakan dengan yang sering bi bubuhkan dalam bidanf Teknik Kimia,materi sua yang sering bi bubuh bidanf teknik kimia,0
good job,good job,0
Jangan menyerah bapak,jangan serah bapak,1
Tugas yng diberikan berupa file lalu dikirin via E-mail jadi tidak dikembalikan,tugas yng beri upa file lalu dikirin via e-mail jadi kembali,0
"Tugas On-line, jadi jarang dikembalikan. Cara mengajarnya sangat bagus dan kalau bisa mengampu satu semester jangan hanya separuh saja",tugas on-line jadi jarang cara ajar sangat bagus kalau ampu satu semester jangan paruh,0
Lebih memberikan latihan soal sampai paham. Soal ujian sesuai ddengan yang pernah diajarkan,lebih beri latih soal paham soal uji sesuai ddengan pernah ajar,0
Jadilah kaprodi supaya merubah pemikiran/pandangan Teknik Kimia,jadi kaprodi rubah pikir pandang teknik kimia,0
usahakan tepat waktu ketika masuk maupun keluar jam kuliah,usaha tepat waktu masuk maupun keluar jam kuliah,0
Tingkatkan..,tingkat,0
tolong berikan materi dan contoh yang jelas,ikan materi contoh jelas,0
lebih tepat waktu,lebih tepat waktu,1
cara mengajar sulit dipahami,cara ajar sulit paham,0
lebih mengerti mahasiswa,lebih erti mahasiswa,0
cara mengajar kurang menarik,cara ajar kurang tarik,0
Penjelasan terlalu cepat.,jelas terlalu cepat,0
perbanyak pembahasan soal,banyak bahas soal,0
penjelasannya terlalu cepat,jelas terlalu cepat,0
Kelas panas susah konsentrasi.,kelas panas susah konsentrasi,1
lebih tepat waktu,lebih tepat waktu,1
lebih tepat waktu,lebih tepat waktu,1
lebih diperbanyak tugasnya,lebih banyak tugas,0
jangan terlalu cepat,jangan terlalu cepat,0
jangan terlalu cepat,jangan terlalu cepat,0
jangan terlalu cepat,jangan terlalu cepat,0
"jangan terlalu cepat, suara dikeraskan lagi",jangan terlalu cepat suara keras,0
terlalu cepat dalam menjelaskan materi,terlalu cepat jelas materi,0
dalam penyampaian materi tolong lebih diperjelas lagi,sampai materi lebih jelas,0
tolong lebih tegas,lebih tegas,0
kurang jelas,kurang jelas,0
jangan pelit nilai ya pak,jangan pelit nilai pak,1
perbanyak latihan dikelas,banyak latih kelas,0
pak kami butuh pemgertian,pak butuh pemgertian,1
bpk sangat penter pak god job tetap mengampu mata kuliah ya pak,bpk sangat penter pak god job tetap ampu mata kuliah pak,1
lanjutkan,lanjut,0
mantab,mantab,0
sangat baik,sangat baik,1
tolong lebih tepat waktu pak,lebih tepat waktu pak,1
jangan sering terlambat,jangan sering lambat,0
bapak datang dong sebelum kita pulang,bapak datang dong kita pulang,0
tolong pak tolong,pak,1
jangan telat lagi ya ingat kontrak kuliah kita,jangan telat ya ingat kontrak kuliah,1
mohon tepT WAKTU,mohon tept waktu,0
AGAR RAJIN DATANG TEPAT WAKTU,rajin datang tepat waktu,1
TEPAT WAKTU YA PAK,tepat waktu pak,1
TEPAT WAKTU YA PAK,tepat waktu pak,1
DOSEN STUDI ISLAM INI TIDAK BERNIAT MENJADI DOSEN,dosen studi islam tidak niat jadi dosen,1
CUKUP HADIR SETIAP HARI SUDAH CUKUP BUAT KAMI,cukup hadir tiap hari cukup buat,0
Sampaikan materi secara jelas dan mudah dipahami..,materi cara jelas mudah paham,0
Ruang kelas perlu AC.,ruang kelas perlu ac,0
Rasulullah mendidik dg kasih sayang bukan dg nafsu.,rasulullah didik dg kasih sayang bukan dg nafsu,1
Merasa tertekan.,rasa tekan,0
Harap menguasai materi.,harap kuasa materi,1
Sebaiknya ketika menjelaskan materi dosen menyuruh mhs utk diam agar materi mudah dipahami.,baik jelas materi dosen suruh mhs utk diam materi mudah paham,0
Bu jangan cepet ngomel.,bu jangan cepet ngomel,0
"Mengajar dengan senyum,...",ajar senyum,0
Pakai mikrophone pak! Agar semua dengar penjelasn bapak,pakai mikrophone pak semua dengar penjelasn bapak,1
bagus,bagus,1
Pertahankan cara mengajarnya.,tahan cara ajar,0
Penjelasan materi kurang dimengerti,jelas materi kurang erti,0
"Kalau menerangkan harus pakai Mix Pak , biar jelas",kalau terang pakai mix pak biar jelas,1
Kalau mengajar harus lebih semangat,kalau ajar lebih semangat,0
mengajar sesuai prosedur,ajar sesuai prosedur,0
Mengajar gunakan sound system,ajar sound system,0
"Cara mengajar lumayan meningkatkan minat belajar mhs, hanya terlalu cepat dlm menjelaskan.",cara ajar lumayan tingkat minat ajar mhs terlalu cepat dlm jelas,0
Oke pak lanjutkan.,oke pak lanjut,1
Kalau menjelaskan tolong menggunakan pengeras suara/mix,kalau jelas guna keras suara mix,0
Josss..,josss,0
Lebih seru lagi dalam mengajar dan jangan terlalu cepat,lebih seru dalam ajar jangan terlalu cepat,0
